date,event,cost,revenue,net,currency
2026-03-06 07:49:05,AI Summary: Machine-learning approach to dissect the clinical heterogeneity of IBD-associated fatigue,0.00012,0.00000,-0.00012,USD
2026-03-06 07:49:05,AI Summary: Mobile-accessible deep learning-based self-assessment tool for measles screening in low-resource settings,0.00012,0.00000,-0.00012,USD
2026-03-06 07:49:05,AI Summary: Explainable temporal graph-based CNNs for predicting hip replacement risk using EHR data,0.00012,0.00000,-0.00012,USD
2026-03-06 07:49:05,AI Summary: Detecting sleep stages after stroke using wearable sensors: machine learning design and challenges,0.00012,0.00000,-0.00012,USD
2026-03-06 07:49:05,AI Summary: Development and evaluation of an AI-based prediction model for chronic kidney disease after cardiac surgery,0.00012,0.00000,-0.00012,USD
2026-03-06 07:49:14,AI Summary: Machine-learning approach to d...,0.00012,0.0,-0.00012,USD
2026-03-06 07:49:14,AI Summary: Mobile-accessible deep learnin...,0.00012,0.0,-0.00012,USD
2026-03-06 07:49:14,AI Summary: Explainable temporal graph-bas...,0.00012,0.0,-0.00012,USD
2026-03-06 07:49:14,AI Summary: Detecting sleep stages after s...,0.00012,0.0,-0.00012,USD
2026-03-06 07:49:14,AI Summary: Development and evaluation of ...,0.00012,0.0,-0.00012,USD
2026-03-06 07:49:34,AI Summary: Machine-learning approach to dissect the clinical heterogeneity of IBD-associated fatigue,0.00012,0.00000,-0.00012,USD
2026-03-06 07:49:34,AI Summary: Mobile-accessible deep learning-based self-assessment tool for measles screening in low-resource settings,0.00012,0.00000,-0.00012,USD
2026-03-06 07:49:34,AI Summary: Explainable temporal graph-based CNNs for predicting hip replacement risk using EHR data,0.00012,0.00000,-0.00012,USD
2026-03-06 07:49:34,AI Summary: Detecting sleep stages after stroke using wearable sensors: machine learning design and challenges,0.00012,0.00000,-0.00012,USD
2026-03-06 07:49:34,AI Summary: Development and evaluation of an AI-based prediction model for chronic kidney disease after cardiac surgery,0.00012,0.00000,-0.00012,USD
2026-03-06 07:50:17,AI Summary: Exposing the fragility of LLM reasoning through bias-inducing prompts: evidence from BiasMedQA,0.00012,0.00000,-0.00012,USD
2026-03-06 07:50:17,AI Summary: Priorities for artificial intelligence education: clinicians perspectives,0.00012,0.00000,-0.00012,USD
2026-03-06 07:50:17,AI Summary: In vivo clinical effectiveness of artificial intelligence screening for acute coronary syndrome: testing real-world performance,0.00012,0.00000,-0.00012,USD
2026-03-06 07:50:17,AI Summary: Mixed-methods evaluation of clinician experiences and adoption patterns of an EHR-integrated generative AI-based clinical decision support uptake by clinicians in Kenya,0.00012,0.00000,-0.00012,USD
2026-03-06 07:50:17,AI Summary: Deja vu in healthcare AI: lessons from the worlds pioneer AI clinical decision support system,0.00012,0.00000,-0.00012,USD
2026-03-06 07:50:48,AI Summary: Public perceptions of health data sharing for artificial intelligence research: a qualitative focus group study in the UK,0.00012,0.00000,-0.00012,USD
2026-03-06 07:50:48,AI Summary: Unlocking AIs value: the HTA approach to responsible healthcare integration,0.00012,0.00000,-0.00012,USD
2026-03-06 07:50:48,AI Summary: How data drift impacts the safety and interpretability of machine learning models predicting risk from blood glucose control,0.00012,0.00000,-0.00012,USD
2026-03-06 07:50:48,AI Summary: Welcome to BMJ Digital Health & AI,0.00012,0.00000,-0.00012,USD
2026-03-06 07:50:48,AI Summary: Healthcare professionals views on implementing digital health tools in psychosis: a national survey in the UK,0.00012,0.00000,-0.00012,USD
2026-03-06 08:06:43,AI Summary: Establishment and validation of an artificial intelligence-based system for identifying the culprit vessel in patients with ST-segment elevated myocardial infarction: the ALERT study,0.00012,0.00000,-0.00012,USD
2026-03-06 08:06:43,AI Summary: The AI loop: redefining medical research from data to clinical decisions,0.00012,0.00000,-0.00012,USD
2026-03-06 08:06:43,AI Summary: Optimising large language models for clinical information extraction: a benchmarking study in the context of ulcerative colitis research,0.00012,0.00000,-0.00012,USD
2026-03-06 08:06:43,AI Summary: Large language model enhanced framework for systematic reviews and meta-analyses,0.00012,0.00000,-0.00012,USD
2026-03-06 08:06:43,AI Summary: Next-generation wearable sensors for biopsychosocial care in mental health: a narrative review,0.00012,0.00000,-0.00012,USD
2026-03-06 08:07:26,AI Summary: INSIGHTFUL: insight generation through clinical annotation, analysis and modelling of suicide-related factors towards understanding and lifesaving,0.00012,0.00000,-0.00012,USD
2026-03-06 08:07:26,AI Summary: Interpretable machine learning-based detection of coeliac disease,0.00012,0.00000,-0.00012,USD
2026-03-06 08:07:26,AI Summary: High-accuracy ECG image interpretation using parameter-efficient Low-Rank Adaptation (LoRA) fine-tuning with multimodal LLaMA V.3.2,0.00012,0.00000,-0.00012,USD
2026-03-06 08:07:26,AI Summary: Patterns of online consultation use in Great Britain, 2019-2023: an observational analysis,0.00012,0.00000,-0.00012,USD
2026-03-06 08:07:26,AI Summary: Can generative AI assess PTSD? A clinical validation study of transcribed and direct audio input modalities,0.00012,0.00000,-0.00012,USD
2026-03-06 10:42:50,AI Summary: Importance of model governance in clinical AI models: case study on the relevance of data drift detection,0.00012,0.00000,-0.00012,USD
2026-03-06 10:42:50,AI Summary: Generative artificial intelligence in medicine: a mixed-methods survey of UK general practitioners,0.00012,0.00000,-0.00012,USD
2026-03-06 10:42:50,AI Summary: Impact of acoustic and informational noise on AI-generated clinical summaries,0.00012,0.00000,-0.00012,USD
2026-03-06 10:42:50,AI Summary: MedMobile: a mobile-sized language model with clinical capabilities,0.00012,0.00000,-0.00012,USD
2026-03-06 10:42:50,AI Summary: Smartphone barrier: uncovering the digital divide in mHealth prevention among disadvantaged middle-aged and older-aged UK communities,0.00012,0.00000,-0.00012,USD
2026-03-06 13:05:57,AI Summary: Concurrent prediction of in-hospital mortality and length of stay using single-task, multiclass and multitask machine learning,0.00012,0.00000,-0.00012,USD
2026-03-06 13:05:57,AI Summary: Evaluating the environmental sustainability of AI in radiology: a systematic review of current practice,0.00012,0.00000,-0.00012,USD
2026-03-06 13:05:57,AI Summary: "Trying to Do No Harm": exploring clinician concerns towards the use of AI for risk prediction in psychiatry,0.00012,0.00000,-0.00012,USD
2026-03-06 13:05:57,AI Summary: Clinical decision support systems effect in reducing medication errors and adverse drug events: an expanded review from Making Healthcare Safer IV,0.00012,0.00000,-0.00012,USD
2026-03-06 13:05:57,AI Summary: Responsible artificial intelligence in healthcare: a systematic review on the use of ethical principles in the development and deployment of artificial intelligence,0.00012,0.00000,-0.00012,USD
2026-03-07 06:12:16,AI Deep Summary: Evaluation of machine learning models for early prediction of gestational diabetes using retrospective electronic health records from current and previous pregnancies,0.00000,0.00000,0.00000,USD
2026-03-07 06:12:17,AI Deep Summary: Trust in large language model-based solutions in healthcare among people with and without diabetes: a cross-sectional survey from the Health in Central Denmark cohort,0.00000,0.00000,0.00000,USD
2026-03-07 06:12:18,AI Deep Summary: Clinical AI Scribes in primary care: accuracy, error severity and implications for clinical practice,0.00000,0.00000,0.00000,USD
